{
  "schema_version": "flow.extension-resolution/v1",
  "case_id": "incompatible-version",
  "requested_capability": "aniflow/analyze-temporal",
  "candidates": [
    {
      "extension_id": "org.example.future-adapter",
      "version": "2.0.0",
      "publisher_id": "org.example",
      "integrity": "aaaaaaaaaaaaaaaaaaaaaaaaaaaaaaaaaaaaaaaaaaaaaaaaaaaaaaaaaaaaaaaa",
      "precedence": 100,
      "compatible": false,
      "authorized": true,
      "available": true,
      "reasons": ["Requires unsupported contract family flow.extension-result/v2."]
    }
  ],
  "result": "no-compatible-provider",
  "selected_extension_ids": [],
  "fallback_order": [],
  "reasons": ["No candidate supports the required v1 contract family."]
}
